{
  "$schema": "https://json-schema.org/draft/2020-12/schema",
  "title": "ARFI INC-15C.6H source bounded inc15c6h-counsel-authority-boundaries",
  "type": "object",
  "additionalProperties": false,
  "required": [
    "model_version",
    "model_family",
    "root_HHS_OGC_reference",
    "root_HHS_OIG_reference",
    "root_HHS_FDA_reference",
    "source_qualified_1997_OIG_historical_components",
    "current_HHS_OIG_whole_authority_certified",
    "OIG_1997_organization_current_day_unqualified",
    "removed_regulation_5_1105_as_of_date",
    "source_OGC_citation_after_removal",
    "FDA_post_repeal_observation_epoch",
    "FDA_source_observes_direct_professional_reporting_to_HHS_General_Counsel",
    "FDA_counsel_institution_abolition_established",
    "OIG_independent_legal_counsel_exception_source_retained",
    "OGC_supervisory_override_of_OIG_counsel",
    "signed_current_OIG_legal_delegations_verified",
    "ALJ_case_control_by_OGC_or_OIG_derived",
    "no_new_legal_institutions_created",
    "current_HHS_first_level_legal_denominator",
    "source_relationship_count",
    "items"
  ],
  "properties": {
    "model_version": {
      "const": "0.1.0"
    },
    "model_family": {
      "const": "inc15c6h-counsel-authority-boundaries"
    },
    "root_HHS_OGC_reference": {
      "const": "INC15C3-HHS-LINK-OGC"
    },
    "root_HHS_OIG_reference": {
      "const": "INC15C3-HHS-LINK-OIG"
    },
    "root_HHS_FDA_reference": {
      "const": "INC15C3-HHS-LINK-FDA"
    },
    "source_qualified_1997_OIG_historical_components": {
      "const": 7
    },
    "current_HHS_OIG_whole_authority_certified": {
      "const": false
    },
    "OIG_1997_organization_current_day_unqualified": {
      "const": true
    },
    "removed_regulation_5_1105_as_of_date": {
      "const": "2026-06-15"
    },
    "source_OGC_citation_after_removal": {
      "const": "2026-09-29"
    },
    "FDA_post_repeal_observation_epoch": {
      "const": "2026-10-13"
    },
    "FDA_source_observes_direct_professional_reporting_to_HHS_General_Counsel": {
      "const": true
    },
    "FDA_counsel_institution_abolition_established": {
      "const": false
    },
    "OIG_independent_legal_counsel_exception_source_retained": {
      "const": true
    },
    "OGC_supervisory_override_of_OIG_counsel": {
      "const": false
    },
    "signed_current_OIG_legal_delegations_verified": {
      "const": false
    },
    "ALJ_case_control_by_OGC_or_OIG_derived": {
      "const": false
    },
    "no_new_legal_institutions_created": {
      "const": 0
    },
    "current_HHS_first_level_legal_denominator": {
      "const": null
    },
    "source_relationship_count": {
      "const": 11
    },
    "items": {
      "type": "array",
      "minItems": 11,
      "maxItems": 11,
      "items": {
        "type": "object",
        "additionalProperties": false,
        "required": [
          "id",
          "relationship_type",
          "source_subject_reference",
          "source_object_reference",
          "official_locator",
          "bounded_source_analysis",
          "evidence_source_edition_or_event_date",
          "citation_referencing_edition_date",
          "disputed_provision",
          "full_original_custody_state",
          "independent_external_legal_certification",
          "professional_HHS_OGC_reporting_not_abolished_by_information_rule",
          "HHS_OIG_counsel_not_supervised_by_OGC",
          "no_synthetic_signed_delegation_or_ALJ_control",
          "normative_policy_model_created",
          "new_canonical_federal_agency_identifier",
          "source_local_nonadditive_edge",
          "index"
        ],
        "properties": {
          "id": {
            "type": "string",
            "pattern": "^INC15C6H-"
          },
          "relationship_type": {
            "enum": [
              "historical_CFR_editorial_context",
              "legal_text_removed_before_citation",
              "concurrent_contact_section_revocation",
              "regulatory_organizational_pointer_replacement",
              "publisher_observed_professional_reporting_after_revocation",
              "publisher_claim_separate_from_obsolete_citation",
              "historical_inspector_general_counsel_reorganization",
              "independent_counsel_exception",
              "nonadditive_1997_to_2025_OIG_organization",
              "presidential_order_legal_interpretation_scope_with_general_provisions",
              "no_budget_reorganization_derived_from_counsel_citation"
            ]
          },
          "source_subject_reference": {
            "type": "string"
          },
          "source_object_reference": {
            "type": "string"
          },
          "official_locator": {
            "type": "string"
          },
          "bounded_source_analysis": {
            "type": "string"
          },
          "evidence_source_edition_or_event_date": {
            "type": "string"
          },
          "citation_referencing_edition_date": {
            "type": [
              "null",
              "string"
            ]
          },
          "disputed_provision": {
            "type": "string"
          },
          "full_original_custody_state": {
            "type": "string"
          },
          "independent_external_legal_certification": {
            "type": "string"
          },
          "professional_HHS_OGC_reporting_not_abolished_by_information_rule": {
            "const": true
          },
          "HHS_OIG_counsel_not_supervised_by_OGC": {
            "const": true
          },
          "no_synthetic_signed_delegation_or_ALJ_control": {
            "const": true
          },
          "normative_policy_model_created": {
            "const": false
          },
          "new_canonical_federal_agency_identifier": {
            "const": null
          },
          "source_local_nonadditive_edge": {
            "const": true
          },
          "index": {
            "type": "integer"
          }
        }
      }
    }
  }
}
