{
  "model_version": "0.1.0",
  "model_family": "inc15c6h-counsel-authority-boundaries",
  "root_HHS_OGC_reference": "INC15C3-HHS-LINK-OGC",
  "root_HHS_OIG_reference": "INC15C3-HHS-LINK-OIG",
  "root_HHS_FDA_reference": "INC15C3-HHS-LINK-FDA",
  "source_qualified_1997_OIG_historical_components": 7,
  "current_HHS_OIG_whole_authority_certified": false,
  "OIG_1997_organization_current_day_unqualified": true,
  "removed_regulation_5_1105_as_of_date": "2026-06-15",
  "source_OGC_citation_after_removal": "2026-09-29",
  "FDA_post_repeal_observation_epoch": "2026-10-13",
  "FDA_source_observes_direct_professional_reporting_to_HHS_General_Counsel": true,
  "FDA_counsel_institution_abolition_established": false,
  "OIG_independent_legal_counsel_exception_source_retained": true,
  "OGC_supervisory_override_of_OIG_counsel": false,
  "signed_current_OIG_legal_delegations_verified": false,
  "ALJ_case_control_by_OGC_or_OIG_derived": false,
  "no_new_legal_institutions_created": 0,
  "current_HHS_first_level_legal_denominator": null,
  "source_relationship_count": 11,
  "items": [
    {
      "id": "INC15C6H-AUTHORITY-FDA-OLD-FOOTNOTE",
      "relationship_type": "historical_CFR_editorial_context",
      "source_subject_reference": "INC15C6H-EDITION-CFR2025",
      "source_object_reference": "INC15C6H-EDITION-OGC2026",
      "official_locator": "2025 CFR §5.1105 and editorial footnote 1, printed page 195",
      "bounded_source_analysis": "former §5.1105 editorial context describes OCC/HHS OGC affiliation, but is not a current legally operative rule",
      "evidence_source_edition_or_event_date": "2025-04-01",
      "citation_referencing_edition_date": null,
      "disputed_provision": "21 CFR 5.1105",
      "full_original_custody_state": "source_era_publisher_original_retained",
      "independent_external_legal_certification": "unresolved_qualification_not_general_legal_opinion",
      "professional_HHS_OGC_reporting_not_abolished_by_information_rule": true,
      "HHS_OIG_counsel_not_supervised_by_OGC": true,
      "no_synthetic_signed_delegation_or_ALJ_control": true,
      "normative_policy_model_created": false,
      "new_canonical_federal_agency_identifier": null,
      "source_local_nonadditive_edge": true,
      "index": 1
    },
    {
      "id": "INC15C6H-AUTHORITY-FDA-REVOCATION",
      "relationship_type": "legal_text_removed_before_citation",
      "source_subject_reference": "INC15C6H-EDITION-FDA2026",
      "source_object_reference": "INC15C6H-EDITION-OGC2026",
      "official_locator": "2026 FDA final rule §5.1105 removal, 91 FR 35886",
      "bounded_source_analysis": "official FDA rule removed §5.1105 on 2026-06-15, before OGC notice cited §5.1105 on 2026-09-29",
      "evidence_source_edition_or_event_date": "2026-06-15",
      "citation_referencing_edition_date": "2026-09-29",
      "disputed_provision": "21 CFR 5.1105",
      "full_original_custody_state": "source_era_publisher_original_retained",
      "independent_external_legal_certification": "unresolved_qualification_not_general_legal_opinion",
      "professional_HHS_OGC_reporting_not_abolished_by_information_rule": true,
      "HHS_OIG_counsel_not_supervised_by_OGC": true,
      "no_synthetic_signed_delegation_or_ALJ_control": true,
      "normative_policy_model_created": false,
      "new_canonical_federal_agency_identifier": null,
      "source_local_nonadditive_edge": true,
      "index": 2
    },
    {
      "id": "INC15C6H-AUTHORITY-FDA-1110",
      "relationship_type": "concurrent_contact_section_revocation",
      "source_subject_reference": "INC15C6H-EDITION-FDA2026",
      "source_object_reference": "INC15C6H-EDITION-OGC2026",
      "official_locator": "2026 FDA final rule §5.1110 removal, 91 FR 35886",
      "bounded_source_analysis": "second contact-list section §5.1110 removed; distinct from FDA Chief Counsel professional chain",
      "evidence_source_edition_or_event_date": "2026-06-15",
      "citation_referencing_edition_date": null,
      "disputed_provision": "21 CFR 5.1105",
      "full_original_custody_state": "source_era_publisher_original_retained",
      "independent_external_legal_certification": "unresolved_qualification_not_general_legal_opinion",
      "professional_HHS_OGC_reporting_not_abolished_by_information_rule": true,
      "HHS_OIG_counsel_not_supervised_by_OGC": true,
      "no_synthetic_signed_delegation_or_ALJ_control": true,
      "normative_policy_model_created": false,
      "new_canonical_federal_agency_identifier": null,
      "source_local_nonadditive_edge": true,
      "index": 3
    },
    {
      "id": "INC15C6H-AUTHORITY-FDA-REPLACEMENT",
      "relationship_type": "regulatory_organizational_pointer_replacement",
      "source_subject_reference": "INC15C6H-EDITION-FDA2026",
      "source_object_reference": "INC15C6H-EDITION-FDACHART2026",
      "official_locator": "2026 FDA final rule §5.1100",
      "bounded_source_analysis": "revised section references FDA public organizational resources and Staff Manual Guides; does not independently implement a new internal FDA chain",
      "evidence_source_edition_or_event_date": "2026-06-15",
      "citation_referencing_edition_date": null,
      "disputed_provision": "21 CFR 5.1105",
      "full_original_custody_state": "source_era_publisher_original_retained",
      "independent_external_legal_certification": "unresolved_qualification_not_general_legal_opinion",
      "professional_HHS_OGC_reporting_not_abolished_by_information_rule": true,
      "HHS_OIG_counsel_not_supervised_by_OGC": true,
      "no_synthetic_signed_delegation_or_ALJ_control": true,
      "normative_policy_model_created": false,
      "new_canonical_federal_agency_identifier": null,
      "source_local_nonadditive_edge": true,
      "index": 4
    },
    {
      "id": "INC15C6H-AUTHORITY-FDA-POST",
      "relationship_type": "publisher_observed_professional_reporting_after_revocation",
      "source_subject_reference": "INC15C6H-EDITION-FDACHART2026",
      "source_object_reference": "INC15C6H-EDITION-OGC2026",
      "official_locator": "FDA 2026-10-13 chart, OCC DCAA",
      "bounded_source_analysis": "FDA publishes Chief Counsel direct reporting to HHS General Counsel and advice to FDA Commissioner; editorial update does not certify legal currentness of erased 5.1105",
      "evidence_source_edition_or_event_date": "2026-10-13",
      "citation_referencing_edition_date": "2026-09-29",
      "disputed_provision": "21 CFR 5.1105",
      "full_original_custody_state": "source_era_publisher_original_retained",
      "independent_external_legal_certification": "unresolved_qualification_not_general_legal_opinion",
      "professional_HHS_OGC_reporting_not_abolished_by_information_rule": true,
      "HHS_OIG_counsel_not_supervised_by_OGC": true,
      "no_synthetic_signed_delegation_or_ALJ_control": true,
      "normative_policy_model_created": false,
      "new_canonical_federal_agency_identifier": null,
      "source_local_nonadditive_edge": true,
      "index": 5
    },
    {
      "id": "INC15C6H-AUTHORITY-FDA-PLACEMENT",
      "relationship_type": "publisher_claim_separate_from_obsolete_citation",
      "source_subject_reference": "INC15C6H-EDITION-OGC2026",
      "source_object_reference": "INC15C6G-OGC-REL-29",
      "official_locator": "2026 OGC §II.A.1.e, 91 FR 61423",
      "bounded_source_analysis": "source claims OCC administrative location within FDA and professional placement within OGC, while citing a removed CFR section",
      "evidence_source_edition_or_event_date": "2026-09-29",
      "citation_referencing_edition_date": null,
      "disputed_provision": "21 CFR 5.1105",
      "full_original_custody_state": "source_era_publisher_original_retained",
      "independent_external_legal_certification": "unresolved_qualification_not_general_legal_opinion",
      "professional_HHS_OGC_reporting_not_abolished_by_information_rule": true,
      "HHS_OIG_counsel_not_supervised_by_OGC": true,
      "no_synthetic_signed_delegation_or_ALJ_control": true,
      "normative_policy_model_created": false,
      "new_canonical_federal_agency_identifier": null,
      "source_local_nonadditive_edge": true,
      "index": 6
    },
    {
      "id": "INC15C6H-AUTHORITY-OIG-1997",
      "relationship_type": "historical_inspector_general_counsel_reorganization",
      "source_subject_reference": "INC15C6H-EDITION-OIG1997",
      "source_object_reference": "INC15C3-HHS-LINK-OIG",
      "official_locator": "62 FR 30859–30865; 1997 Chapter AF §AF.10, AFG",
      "bounded_source_analysis": "1997 source describes an OIG OCIG inside OIG's seven-unit source-era structure, not the complete current 2026 OIG organization",
      "evidence_source_edition_or_event_date": "1997-06-05",
      "citation_referencing_edition_date": null,
      "disputed_provision": "21 CFR 5.1105",
      "full_original_custody_state": "source_era_publisher_original_retained",
      "independent_external_legal_certification": "unresolved_qualification_not_general_legal_opinion",
      "professional_HHS_OGC_reporting_not_abolished_by_information_rule": true,
      "HHS_OIG_counsel_not_supervised_by_OGC": true,
      "no_synthetic_signed_delegation_or_ALJ_control": true,
      "normative_policy_model_created": false,
      "new_canonical_federal_agency_identifier": null,
      "source_local_nonadditive_edge": true,
      "index": 7
    },
    {
      "id": "INC15C6H-AUTHORITY-OIG-EXCEPTION",
      "relationship_type": "independent_counsel_exception",
      "source_subject_reference": "INC15C6H-EDITION-OIG1997",
      "source_object_reference": "INC15C6G-OGC-REL-28",
      "official_locator": "OGC 2026 Section I; 62 FR 30859 citation",
      "bounded_source_analysis": "2026 OGC excludes OIG matters within its jurisdiction, tied to OIG historical OCIG source; does not create OGC oversight of IG counsel",
      "evidence_source_edition_or_event_date": "2026-09-29",
      "citation_referencing_edition_date": null,